<?xml version="1.0" encoding="UTF-8" ?>
<?xml-stylesheet type="text/css" href="komis.css"?>
<Komis
    xmlns='http://www.pkck.com'
    xmlns:xsi='http://www.w3.org/2001/XMLSchema-instance'
    xsi:schemaLocation='http://www.pkck.com komis.xsd'>
	<authors>
		<student>Roman Chomik</student>
		<student>Filip Wróbel</student>
	</authors>
	<dane>
	<content>
	<personel>
		<pracownik id_pracownika="i2">
			<imie>Jan</imie>
			<nazwisko>Kowalski</nazwisko>
		</pracownik>
		<pracownik id_pracownika="i3">
			<imie>Mieczysław</imie>
			<nazwisko>Skowronek</nazwisko>
		</pracownik>
	</personel>
	<stan-aktualne>
		<samochód nr_katalogowy="i532" >
			<dane_ogólne>
				<marka>opel</marka>
				<model>astra1</model>
				<kolor>zielony</kolor>
			</dane_ogólne>
			<dane_sprzedaży>
				<cena>5000</cena>
				<na_raty>nie</na_raty>
			</dane_sprzedaży>
			<dane_techniczne>
				<paliwo>benzyna</paliwo>
				<pojemność_silnika>1.6</pojemność_silnika>
				<typ>sedan</typ>
				<rocznik>1999</rocznik>
			</dane_techniczne>
		</samochód>
		<samochód nr_katalogowy="i533" >
			<dane_ogólne>
				<marka>opel</marka>
				<model>astra2</model>
				<kolor>zielony</kolor>
			</dane_ogólne>
			<dane_sprzedaży>
				<cena>7000</cena>
				<na_raty>tak</na_raty>
				</dane_sprzedaży>
			<dane_techniczne>
				<paliwo>benzyna</paliwo>
				<pojemność_silnika>1.8</pojemność_silnika>
				<typ>sedan</typ>
				<rocznik>1998</rocznik>
			</dane_techniczne>
		</samochód>
		<samochód nr_katalogowy="i534" >
			<dane_ogólne>
				<marka>opel</marka>
				<model>astra2</model>
				<kolor>czerwony</kolor>
			</dane_ogólne>
			<dane_sprzedaży>
				<cena>9000</cena>
				<na_raty>nie</na_raty>
			</dane_sprzedaży>
			<dane_techniczne>
				<paliwo>diesel</paliwo>
				<pojemność_silnika>1.9</pojemność_silnika>
				<typ>komb</typ>
				<rocznik>2002</rocznik>
			</dane_techniczne>
		</samochód>
		<samochód nr_katalogowy="i535" >
			<dane_ogólne>
				<marka>volkswagen</marka>
				<model>golf4</model>
				<kolor>srebrny</kolor>
			</dane_ogólne>
			<dane_sprzedaży>
				<cena>5000</cena>
				<na_raty>nie</na_raty>
			</dane_sprzedaży>
			<dane_techniczne>
				<paliwo>diesel</paliwo>
				<pojemność_silnika>1.6</pojemność_silnika>
				<typ>coupe</typ>
				<rocznik>1998</rocznik>
			</dane_techniczne>
		</samochód>
		<samochód nr_katalogowy="i536">
			<dane_ogólne>
				 <marka>volkswagen</marka>
				<model>golf5</model>
				<kolor>czarny</kolor>
			</dane_ogólne>
			<dane_sprzedaży>
				<cena>11000</cena>
				<na_raty>tak</na_raty>
			</dane_sprzedaży>
			<dane_techniczne>
				<paliwo>benzyna</paliwo>
				<pojemność_silnika>2.0</pojemność_silnika>
				<typ>coupe</typ>
				<rocznik>2001</rocznik>
			</dane_techniczne>
		</samochód>
		<samochód nr_katalogowy="i537" >
			<dane_ogólne>
				<marka>volkswagen</marka>
				<model>passat</model>
				<kolor>bialy</kolor>
			</dane_ogólne>
			<dane_sprzedaży>
				<cena>15000</cena>
				<na_raty>tak</na_raty>
			</dane_sprzedaży>
			<dane_techniczne>
				<paliwo>diesel</paliwo>
				<pojemność_silnika>2.0</pojemność_silnika>
				<typ>komb</typ>
				<rocznik>2002</rocznik>
			</dane_techniczne>
		</samochód>	
		<samochód nr_katalogowy="i538" >
			<dane_ogólne>
				<marka>volkswagen</marka>
				<model>passat</model>
				<kolor>zielony</kolor>
			</dane_ogólne>
			<dane_sprzedaży>
				<cena>17000</cena>
				<na_raty>nie</na_raty>
			</dane_sprzedaży>
			<dane_techniczne>
				<paliwo>diesel</paliwo>
				<pojemność_silnika>2.2</pojemność_silnika>
				<typ>komb</typ>
				<rocznik>2004</rocznik>
			</dane_techniczne>
		</samochód>	
		<samochód nr_katalogowy="i539" >
			<dane_ogólne>
				<marka>volkswagen</marka>
				<model>passat</model>
				<kolor>czerwony</kolor>
			</dane_ogólne>
			<dane_sprzedaży>
				<cena>17000</cena>
				<na_raty>nie</na_raty>
			</dane_sprzedaży>
			<dane_techniczne>
				<paliwo>diesel</paliwo>
				<pojemność_silnika>2.2</pojemność_silnika>
				<typ>komb</typ>
				<rocznik>2003</rocznik>
			</dane_techniczne>
		</samochód>
		<samochód nr_katalogowy="i540" >
			<dane_ogólne>
				<marka>volkswagen</marka>
				<model>polo</model>
				<kolor>zolty</kolor>
			</dane_ogólne>
			<dane_sprzedaży>
				<cena>12000</cena>
				<na_raty>tak</na_raty>
			</dane_sprzedaży>
			<dane_techniczne>
				<paliwo>benzyna</paliwo>
				<pojemność_silnika>1.4</pojemność_silnika>
				<typ>coupe</typ>
				<rocznik>2002</rocznik>
			</dane_techniczne>
		</samochód>
		<samochód nr_katalogowy="i541" >
			<dane_ogólne>
				<marka>volkswagen</marka>
				<model>tiguan</model>
				<kolor>srebrny</kolor>
			</dane_ogólne>
			<dane_sprzedaży>
				<cena>30000</cena>
				<na_raty>nie</na_raty>
			</dane_sprzedaży>
			<dane_techniczne>
				<paliwo>diesel</paliwo>
				<pojemność_silnika>2.6</pojemność_silnika>
				<typ>suv</typ>
				<rocznik>2011</rocznik>
			</dane_techniczne>
		</samochód>
		<samochód nr_katalogowy="i542" >
			<dane_ogólne>
				<marka>volkswagen</marka>
				<model>jetta</model>
				<kolor>srebrny</kolor>
			</dane_ogólne>
			<dane_sprzedaży>
				<cena>22000</cena>
				<na_raty>nie</na_raty>
			</dane_sprzedaży>
			<dane_techniczne>
				<paliwo>diesel</paliwo>
				<pojemność_silnika>2.0</pojemność_silnika>
				<typ>sedan</typ>
				<rocznik>2008</rocznik>
			</dane_techniczne>
		</samochód>
		<samochód nr_katalogowy="i543" >
			<dane_ogólne>
				<marka>fiat</marka>
				<model>panda</model>
				<kolor>czarny</kolor>
			</dane_ogólne>
			<dane_sprzedaży>
				<cena>20000</cena>
				<na_raty>tak</na_raty>
			</dane_sprzedaży>
			<dane_techniczne>
				<paliwo>benzyna</paliwo>
				<pojemność_silnika>1.8</pojemność_silnika>
				<typ>hatchback</typ>
				<rocznik>2010</rocznik>
			</dane_techniczne>
		</samochód>
		<samochód nr_katalogowy="i544" >
			<dane_ogólne>
				<marka>fiat</marka>
				<model>panda</model>
				<kolor>bialy</kolor>
			</dane_ogólne>
			<dane_sprzedaży>
				<cena>25000</cena>
				<na_raty>tak</na_raty>
			</dane_sprzedaży>
			<dane_techniczne>
				<paliwo>diesel</paliwo>
				<pojemność_silnika>2.0</pojemność_silnika>
				<typ>hatchback</typ>
				<rocznik>2012</rocznik>
			</dane_techniczne>
		</samochód>
		<samochód nr_katalogowy="i545" >
			<dane_ogólne>
				<marka>fiat</marka>
				<model>multipla</model>
				<kolor>rozowy</kolor>
			</dane_ogólne>
			<dane_sprzedaży>
				<cena>100</cena>
				<na_raty>tak</na_raty>
			</dane_sprzedaży>
			<dane_techniczne>
				<paliwo>benzyna</paliwo>
				<pojemność_silnika>1.2</pojemność_silnika>
				<typ>hatchback</typ>
				<rocznik>2010</rocznik>
			</dane_techniczne>
		</samochód>
		<samochód nr_katalogowy="i546" >
			<dane_ogólne>
				<marka>fiat</marka>
				<model>punto</model>
				<kolor>niebieski</kolor>
			</dane_ogólne>
			<dane_sprzedaży>
				<cena>10000</cena>
				<na_raty>tak</na_raty>
			</dane_sprzedaży>
			<dane_techniczne>
				<paliwo>benzyna</paliwo>
				<paliwo>lpg</paliwo>
				<pojemność_silnika>1.6</pojemność_silnika>
				<typ>hatchback</typ>
				<rocznik>2006</rocznik>
			</dane_techniczne>
		</samochód>
	</stan-aktualne>
	<stan-archiwum>
		<samochód nr_katalogowy="i530" >
			<dane_ogólne>
				<marka>fiat</marka>
				<model>punto</model>
				<kolor>czerwony</kolor>
			</dane_ogólne>
			<dane_sprzedaży>
				<cena>4500</cena>
				<na_raty>nie</na_raty>
			</dane_sprzedaży>
			<dane_techniczne>
				<paliwo>benzyna</paliwo>
				<pojemność_silnika>1.1</pojemność_silnika>
				<typ>sedan</typ>
				<rocznik>1997</rocznik>
			</dane_techniczne>
		</samochód>
		<samochód nr_katalogowy="i531" >
			<dane_ogólne>
				<marka>volkswagen</marka>
				<model>golf3</model>
				<kolor>zielony</kolor>
			</dane_ogólne>
			<dane_sprzedaży>
				<cena>3400</cena>
				<na_raty>nie</na_raty>
			</dane_sprzedaży>
			<dane_techniczne>
				<paliwo>diesel</paliwo>
				<pojemność_silnika>1.6</pojemność_silnika>
				<typ>sedan</typ>
				<rocznik>1996</rocznik>
			</dane_techniczne>
		</samochód>
	</stan-archiwum>
	<operacje>
		<wpis typ="sprzedaż" id_pracownika="i2" nr_katalogowy="i531" >
			<data>2014-05-23</data>
			<kwota>4500</kwota>
			<uwagi>brak</uwagi>
		</wpis>
		<wpis typ="sprzedaż" id_pracownika="i2" nr_katalogowy="i530" >
			<data>2014-05-25</data>
			<kwota>4500</kwota>
			<uwagi>brak</uwagi>
		</wpis>
	</operacje>
	</content>
	</dane>
</Komis>